{
  "id": "character-adrian-monk",
  "name": "Adrian Monk",
  "work_id": "work-adrian-monk",
  "psychological_experiences": [
    {
      "tag": "contamination fears",
      "evidence_status": "experiential_only",
      "evidence": "Starter interpretation based on broad narrative portrayal; scene-level evidence still needed.",
      "source_ids": [
        "source-adrian-monk"
      ]
    },
    {
      "tag": "ritualized behavior",
      "evidence_status": "experiential_only",
      "evidence": "Starter interpretation based on broad narrative portrayal; scene-level evidence still needed.",
      "source_ids": [
        "source-adrian-monk"
      ]
    },
    {
      "tag": "grief",
      "evidence_status": "experiential_only",
      "evidence": "Starter interpretation based on broad narrative portrayal; scene-level evidence still needed.",
      "source_ids": [
        "source-adrian-monk"
      ]
    },
    {
      "tag": "functional impairment",
      "evidence_status": "experiential_only",
      "evidence": "Starter interpretation based on broad narrative portrayal; scene-level evidence still needed.",
      "source_ids": [
        "source-adrian-monk"
      ]
    }
  ],
  "diagnoses": [
    {
      "tag": "obsessive-compulsive disorder",
      "evidence_status": "explicit_in_work",
      "evidence": "The series identifies Monk as having OCD; verify episode-level evidence.",
      "source_ids": [
        "source-adrian-monk"
      ]
    }
  ],
  "moods": [
    "anxiety",
    "grief",
    "determination"
  ],
  "coping_patterns": [
    "rituals",
    "structured routines",
    "support from others"
  ],
  "journey_ids": [],
  "content_warnings": [
    "bereavement",
    "anxiety",
    "crime-related violence"
  ],
  "source_ids": [
    "source-adrian-monk"
  ],
  "representation_notes": "Series identifies Monk as having OCD; assess when symptoms are played for humor.",
  "review_status": "needs_sources"
}
