{"aliases":[],"content_warnings":["child physical abuse by a parent","parental rejection","scenes of fire and burning"],"coping_patterns":["pursuing his father's approval","hiding behind the Blue Spirit mask","learning from his uncle's steadiness"],"diagnoses":[],"id":"character-zuko","journey_ids":["journey-belonging"],"moods":["shame","anger","resolve"],"name":"Zuko","psychological_experiences":[{"evidence":"Starter interpretation based on broad narrative portrayal; scene-level evidence still needed.","evidence_status":"experiential_only","source_ids":["source-zuko"],"tag":"shame and self-worth"},{"evidence":"Starter interpretation based on broad narrative portrayal; scene-level evidence still needed.","evidence_status":"experiential_only","source_ids":["source-zuko"],"tag":"parental rejection"},{"evidence":"Starter interpretation based on broad narrative portrayal; scene-level evidence still needed.","evidence_status":"experiential_only","source_ids":["source-zuko"],"tag":"identity formation"},{"evidence":"Starter interpretation based on broad narrative portrayal; scene-level evidence still needed.","evidence_status":"experiential_only","source_ids":["source-zuko"],"tag":"making amends"}],"representation_notes":"Portrays a teenager burned and banished by his father for speaking out, who spends years trying to earn back conditional love and slowly learns to define honor for himself. The show never suggests his pain excuses the harm he causes while hunting the Avatar. His turn toward the protagonists is a late-story development.","review_status":"needs_sources","source_ids":["source-zuko"],"work_id":"work-zuko"}