{
  "id": "character-arthur-fleck",
  "name": "Arthur Fleck",
  "work_id": "work-arthur-fleck",
  "psychological_experiences": [
    {
      "tag": "social exclusion",
      "evidence_status": "experiential_only",
      "evidence": "Starter interpretation based on broad narrative portrayal; scene-level evidence still needed.",
      "source_ids": [
        "source-arthur-fleck"
      ]
    },
    {
      "tag": "distress",
      "evidence_status": "experiential_only",
      "evidence": "Starter interpretation based on broad narrative portrayal; scene-level evidence still needed.",
      "source_ids": [
        "source-arthur-fleck"
      ]
    },
    {
      "tag": "inadequate support",
      "evidence_status": "experiential_only",
      "evidence": "Starter interpretation based on broad narrative portrayal; scene-level evidence still needed.",
      "source_ids": [
        "source-arthur-fleck"
      ]
    },
    {
      "tag": "stigma",
      "evidence_status": "experiential_only",
      "evidence": "Starter interpretation based on broad narrative portrayal; scene-level evidence still needed.",
      "source_ids": [
        "source-arthur-fleck"
      ]
    }
  ],
  "diagnoses": [],
  "moods": [
    "despair",
    "anger",
    "alienation"
  ],
  "coping_patterns": [
    "fantasy",
    "withdrawal",
    "violence"
  ],
  "journey_ids": [
    "journey-representation"
  ],
  "content_warnings": [
    "graphic violence",
    "suicide",
    "abuse",
    "mental illness stigma"
  ],
  "source_ids": [
    "source-arthur-fleck"
  ],
  "representation_notes": "Include chiefly to analyze contested representation and harmful links between mental illness and violence.",
  "review_status": "needs_sources"
}
